{
  "run_id": "business_interviews_validation",
  "interviews": [
    "interview_006"
  ],
  "chunks_total": 17,
  "chunks_with_claims": 17,
  "claims_total": 55,
  "claims_by_type": {
    "business_model_claim": 1,
    "marketing_message": 2,
    "open_question": 1,
    "operational_claim": 18,
    "partner_model_claim": 2,
    "qualification_question": 1,
    "risk_or_constraint": 7,
    "sales_process_claim": 5,
    "strategy_claim": 7,
    "technical_claim_needs_confirmation": 11
  },
  "claims_by_business_area": {
    "business_model": 1,
    "marketing": 1,
    "open_question": 1,
    "operations": 18,
    "partner_model": 2,
    "positioning": 1,
    "qualification": 1,
    "risk": 7,
    "sales_process": 5,
    "strategy": 7,
    "technical_context": 11
  },
  "claims_by_review_status": {
    "review_required": 55
  },
  "review_flags": {
    "marketing_claim_review": 6,
    "open_question": 1,
    "price_or_guarantee_review": 6,
    "recognition_noise": 1,
    "strategy_claim_review": 19,
    "technical_confirmation_required": 39
  },
  "technical_confirmation_required": 39,
  "electricians_kb_relevant": 31,
  "chunks_with_zero_claims": [],
  "skipped_items_by_reason": {},
  "validation_errors": [],
  "validation_warnings": [],
  "source_claims_file": "00_input/interviews/statements/interview_006_claims.jsonl",
  "source_chunks_file": "00_input/interviews/chunks/interview_006_chunks.jsonl"
}
