{
  "run_id": "business_interviews_validation",
  "interviews": [
    "interview_002"
  ],
  "chunks_total": 32,
  "chunks_with_claims": 31,
  "claims_total": 87,
  "claims_by_type": {
    "business_model_claim": 13,
    "customer_pain": 4,
    "customer_segment_claim": 4,
    "marketing_message": 1,
    "objection": 1,
    "open_question": 2,
    "operational_claim": 9,
    "positioning_claim": 5,
    "product_claim": 2,
    "recommended_response": 2,
    "risk_or_constraint": 9,
    "sales_case": 2,
    "sales_process_claim": 9,
    "strategy_claim": 18,
    "technical_claim_needs_confirmation": 4,
    "value_proposition_claim": 2
  },
  "claims_by_business_area": {
    "business_model": 13,
    "customer_pain": 3,
    "customer_segment": 4,
    "marketing": 1,
    "objection_handling": 4,
    "open_question": 2,
    "operations": 9,
    "positioning": 5,
    "product": 2,
    "risk": 8,
    "sales_process": 11,
    "strategy": 19,
    "technical_context": 4,
    "value_proposition": 2
  },
  "claims_by_review_status": {
    "review_required": 87
  },
  "review_flags": {
    "marketing_claim_review": 43,
    "open_question": 2,
    "price_or_guarantee_review": 22,
    "public_use_review": 7,
    "strategy_claim_review": 58,
    "technical_confirmation_required": 25
  },
  "technical_confirmation_required": 25,
  "electricians_kb_relevant": 19,
  "chunks_with_zero_claims": [
    "interview_002_chunk_0001"
  ],
  "skipped_items_by_reason": {
    "noise": 1
  },
  "validation_errors": [],
  "validation_warnings": [],
  "source_claims_file": "00_input/interviews/statements/interview_002_claims.jsonl",
  "source_chunks_file": "00_input/interviews/chunks/interview_002_chunks.jsonl"
}
